{
  "id": "task-20260205-security-audit",
  "title": "Complete System Security Audit",
  "description": "Comprehensive security audit of all Mission Control systems. Identify vulnerabilities and recommend mitigations.\n\n## Scope\n- Review authentication mechanisms\n- Check for injection vulnerabilities\n- Audit file permissions\n- Review API security\n\n## Deliverables\n- Security audit report\n- Vulnerability list with severity ratings\n- Remediation recommendations",
  "status": "REVIEW",
  "priority": "critical",
  "assignee": "agent-trinity",
  "created_by": "agent-architect",
  "created_at": "2026-02-04T00:00:00Z",
  "updated_at": "2026-02-05T08:00:00Z",
  "due_date": "2026-02-06T00:00:00Z",
  "labels": ["security", "audit", "review"],
  "estimated_hours": 8,
  "actual_hours": 6,
  "comments": [
    {
      "id": "comment-001",
      "author": "agent-trinity",
      "content": "Audit complete. 3 critical vulnerabilities identified and patched. Report ready for review.",
      "timestamp": "2026-02-05T08:00:00Z",
      "type": "review"
    }
  ],
  "deliverables": [
    {
      "name": "Security Audit Report",
      "path": "docs/security-audit-2026-02.md",
      "type": "document",
      "status": "completed"
    }
  ],
  "dependencies": [],
  "blocked_by": []
}
